{
  "$schema": "../../source/schemas/runtime/runtime-links.schema.json",
  "type": "RUNTIME_LINK_MANIFEST",
  "schemaVersion": 1,
  "marketplace": "slopsentral",
  "entries": [
    {
      "type": "RUNTIME_LINK",
      "id": "codex-intellij-engineering-marketplace-cutover",
      "runtime": "CODEX",
      "sourcePath": "source/plugins/intellij-engineering/plugin.json",
      "targetPath": "intellij-engineering@slopsentral",
      "primitiveTypes": [
        "PLUGIN",
        "SKILL",
        "INSTRUCTION"
      ],
      "strategy": "MARKETPLACE_IMPORT",
      "status": "READY",
      "requiresApproval": true,
      "collisionPolicy": "SKIP_EXISTING",
      "activationCommand": "codex plugin add intellij-engineering@slopsentral",
      "validationCommands": [
        "node source/tools/validate-source-graph.mjs",
        "node source/tools/run-routing-evals.mjs --require-all-observed",
        "intelligence project --source . --harness codex --out /tmp/slopsentral-codex",
        "intelligence project --source . --harness github-copilot --out /tmp/slopsentral-github-copilot"
      ],
      "notes": "After exact-head CI succeeds, refresh the marketplace, move the standalone ide-diagnostics-mcp skill to a recoverable backup outside discovery, remove the prior IntelliJ plugin coordinate, and install this coordinate. No compatibility alias remains."
    },
    {
      "type": "RUNTIME_LINK",
      "id": "codex-kast-operations-idea-backend-import",
      "runtime": "CODEX",
      "sourcePath": "source/plugins/kast-operations/plugin.json",
      "targetPath": "kast-operations@slopsentral",
      "primitiveTypes": [
        "PLUGIN",
        "SKILL",
        "INSTRUCTION"
      ],
      "strategy": "MARKETPLACE_IMPORT",
      "status": "READY",
      "requiresApproval": true,
      "collisionPolicy": "SKIP_EXISTING",
      "activationCommand": "codex plugin add kast-operations@slopsentral",
      "validationCommands": [
        "node source/tools/validate-source-graph.mjs",
        "node source/tools/run-routing-evals.mjs --require-all-observed"
      ],
      "notes": "Install alongside intellij-engineering so Kast-only backend lifecycle and distribution work routes to kast-idea-backend-delivery."
    },
    {
      "type": "RUNTIME_LINK",
      "id": "codex-kotlin-engineering-marketplace-import",
      "runtime": "CODEX",
      "sourcePath": "source/plugins/kotlin-engineering/plugin.json",
      "targetPath": "kotlin-engineering@slopsentral",
      "primitiveTypes": [
        "PLUGIN",
        "SKILL",
        "AGENT",
        "HOOK"
      ],
      "strategy": "MARKETPLACE_IMPORT",
      "status": "READY",
      "requiresApproval": true,
      "collisionPolicy": "SKIP_EXISTING",
      "activationCommand": "codex plugin add kotlin-engineering@slopsentral",
      "validationCommands": [
        "node source/tools/validate-source-graph.mjs",
        "node source/tools/run-routing-evals.mjs --require-all-observed",
        "intelligence project --source . --harness codex --out /tmp/slopsentral-codex",
        "intelligence project --source . --harness github-copilot --out /tmp/slopsentral-github-copilot"
      ],
      "verification": {
        "type": "RUNTIME_LINK_VERIFICATION",
        "verifiedAt": "2026-06-22",
        "status": "INSTALLED_ENABLED",
        "command": "codex plugin list",
        "evidence": [
          "kotlin-engineering@slopsentral is provider-visible as installed and enabled in the local Codex plugin list."
        ],
        "limitations": [
          "This verifies the local runtime coordinate, not that the installed cache contains this branch head.",
          "Team rollout still needs the same provider-visible check in each target environment."
        ]
      },
      "notes": "Codex should consume Kotlin Engineering through the generated marketplace import path. Do not link source folders or edit installed cache payloads; activation requires explicit approval and provider-visible installed-state verification."
    }
  ]
}
